BibliographyType,ISBN,Identifier,Author,Title,Journal,Volume,Number,Month,Pages,Year,Address,Note,URL,Booktitle,Chapter,Edition,Series,Editor,Publisher,ReportType,Howpublished,Institution,Organizations,School,Annote,Custom1,Custom2,Custom3,Custom4,Custom5
7,"","ledermann2010information","Ledermann, Teresa & Renner, Jens","Information? Ja! - Abkupfern? Nein!","BuB Forum Bibliothek und Information",62,6,"June","460-462",2010,"","","","","","","","Schelle-Wolff, Carola","","","","","","","","","","informationskompetenzvermittlung, umfrage, copyandpaste, Bibliothek, hochschulen, plagiatsproblmatik, prüfungswesen, plagiate","",""
1,"","lorenz2009forschungsbibliothek","Lorenz, Miriam; Fühles-Ubach, Simone & Projektteam","Die Forschungsbibliothek der Zukunft","",,,"","",2009,"","","http://publica.fraunhofer.de/eprints/urn:nbn:de:0011-n-948372.pdf","","","","","","Fraunhofer IZB","","","","","","","Gegenstand der Studie ist die Ermittlung, Beschreibung und Bewertung von aktuellen und künftigen Themen und Technologien im weiten Rahmen von Bibliothek und Information in einem wissen-schaftlich orientierten Umfeld.Dieser Rahmen soll die Bereiche der Informationsversorgung und des Informationsmanagements genauso umfassen wie z.B. auch das Publikationsverhalten, die Medienentwicklung oder die Verän-derungen des informationsspezifischen Berufsbildes. Gefordert ist ein breiter und uneingeschränkter Blick auf Themen, Diskussionen oder Produkte, welche im Umfeld von bibliothekarischer Dienstleis-tung Anwendung finden könnten. Alle Szenarien, Prognosen oder auch Utopien sollen als solche identifiziert, verständlich beschrieben und durch ein Literaturverzeichnis ergänzt werden. Durch eine Dokumentation des Suchprozesses werden Rahmen und Vollstän-digkeit der ermittelten Inhalte transparent und nachvollziehbar.","","bibliothek, Zukunftsthemen, suchmaschinen, google, Weblog, Fachinformation, forschungsbibliotheken, zukunft","",""
6,"","harb2008","Harbeck, Matthias & Kobold, Sonja","Spurensicherung – Provenienzforschung zur Bibliothek von Agathe Lasch. Ein Projekt an der Universitätsbibliothek der Humboldt-Universität zu Berlin","",,,"","89-101",2008,"Göttingen","","","Bibliotheken in der NS-Zeit. Provenienzforschung und Bibliotheksgeschichte","","","","Alker, Stefan; Köstner, Christina & Stumpf, Markus","V&R unipress","","","","","","","","","hu, lasch, provenienzforschung, ns-raubgut, berlin, nsraubgut","",""
10,"","Stober.2010","Stöber, Thomas","Literaturverwaltung als Baustein im Serviceangebot der Hochschulbibliotheken: Vortrag auf dem 4. Leipziger Kongreß für Bibliothek und Information","",,,"","",2010,"","","http://www.opus-bayern.de/bib-info/volltexte/2010/897/","","","","","","","","","","","","","","","myown, Literaturverwaltung, Informationskompetenz","",""
9,"","phd/dnb/Stroh93","Stroh, Felicitas","Der Systemcharakter der wissenschaftlichen Bibliothek: Grundlagen und Entwicklungsmöglichkeiten der wissenschaftlichen Bibliotheken der Bundesrepublik Deutschland aus systemtheoretischer Sicht.","",,,"","",1993,"","","","","","","","","","","","","","Humboldt University of Berlin, Germany","","","","dblp","",""
9,"","koberle1924deutsche","Köberle, Sophie","Die deutsche Jugendliteratur in der zweiten Hälfte des 18. Jahrhunderts auf Grund von Nicolais Allgemeiner Deutscher Bibliothek","",,,"","",1924,"","","","","","","","","","","","","","München","","","","dnb","",""
7,"","stockinger2004stefan","Stockinger, Claudia","Stefan George: Gesamtausgabe der Werke. Faksimile und Volltext (Digitale Bibliothek 99). Berlin: Directmedia Publishing 2004, [CD-ROM].","Jahrbuch für Computerphilologie",6,,"","n.p.",2004,"","","http://computerphilologie.digital-humanities.de/jg04/rezensionen/stockrez.html","","","","","Braungart, Georg; Eibl, Karl & Jannidis, Fotis","Mentis Verlag","","","","","","","","","tadirah_meta:_assessing, tadirah_literature","",""
7,"","schmidt-2008-dbs","Bauer, Bruno & Schmidt, Ronald M.","Deutsche Bibliotheksstatistik (DBS): Konzept, Umsetzung und Perspektiven für eine umfassende Datenbasis zum Bibliothekswesen in Deutschland: 10 Fragen von Bruno Bauer an Ronald M. Schmidt, Leiter der DBS","GMS Medizin - Bibliothek - Information",8,1,"","1--7",2008,"","","http://www.egms.de/static/pdf/journals/mbi/2008-8/mbi000102.pdf","","","","","","","","","","","","","Die Deutsche Bibliotheksstatistik (DBS, http://www.bibliotheksstatistik.de) wird seit dem Berichtsjahr 1974 erstellt, wobei die Erfassung, Auswertung und Präsentation der Ergebnisse seit 1999 ausschließlich online erfolgen. Ziel der DBS ist die Schaffung eines nationalen Datenpools für statistische Informationen zu allen Bibliothekssparten. Ca. 9000 Bibliotheken melden jährlich ihre Werte für die Bereiche Ausstattung, Bestand, Nutzung, Finanzen und Personal. Das aktuelle Interview informiert über das Konzept der DBS, die unterschiedliche Ausprägung der DBS für Öffentliche Bibliotheken, für Wissenschaftliche Bibliotheken sowie Spezialbibliotheken. Ausführlich eingegangen wird auch auf das zunehmend wichtiger werdende Thema der Erfassung von statistischen Daten für die Bestände und die Nutzung der elektronischen Bibliothek. Angesprochen werden auch der Auswertungs- und Publikationsprozess der DBS, der Konnex zwischen DBS und BIX sowie die Möglichkeiten der internationalen Kooperation im Bereich der DBS.","","ref, MArbeit, DBS, germany, libraries, statistics","",""
7,"","christian2014linked","Christian, Stein","Linked Open Data – Wie das Web zur Semantik kam","Bibliothek, Forschung und Praxis",38,,"","447-455",2014,"","","http://dx.doi.org/10.1515/bfp-2014-0055","Bibliothek Forschung und Praxis","","","","","","","","","","","","Seit Beginn des Word Wide Web besteht die Idee der universellen Vernetzung von Information in einem einfachen, standardisierten Verfahren. Ein Computer stößt bei der Interpretation von natürlich sprachlicher Bedeutung jedoch schnell an seine Grenzen. Die letzte Generation des Webs, das Semantic Web, schließt diese Lücke und modelliert Semantik explizit und maschinenlesbar – und eröffnet damit neue Möglichkeiten.","","linkedopendata","",""
9,"","koberle1924deutsche","Köberle, Sophie","Die deutsche Jugendliteratur in der zweiten Hälfte des 18. Jahrhunderts auf Grund von Nicolais Allgemeiner Deutscher Bibliothek","",,,"","",1924,"","","","","","","","","","","","","","NA München","","","","dnb","",""
7,"","risse1997entwurf","Risse, Thomas & Hemmje, Matthias","Entwurf und Implementierung einer VRML Bibliothek fuer ein objektrelationales Datenbanksystem auf der Basis des VRML 2.0 Standards ","GMD-Studien",,324,"September","",1997,"","","","","","","","","","","","","","","","","","myown, objectrelational, vrml","",""
9,"","arndt2003medizinische","Arndt, Dagmar","Der medizinische Teil der Bibliothek des mecklenburgischen Herzogs Johann Albrecht (1525 - 1576): eine Rekonstruktion und medizinhistorische Bewertung","",,,"","",2003,"","","","","","","","","","","","","","Uni Rostock","","","","dnb, Gesundheit, Bibliotheks_und_Informationswissenschaft, Medizin","",""
9,"","simon1978fnfzehn","Simon, Petra","Die Fünfzehn Zeichen in der Handschrift Nr. 215 [Nummer zweihundertfünfzehn] der Gräflich-von-Schönborn'schen Bibliothek zu Pommersfelden","",,,"","",1978,"","","","","","","","","","","","","","Uni München","","","","Verlagswesen, Allgemeines, Nachrichtenmedien, Buch_und_Schrift, seltene_Bücher, dnb, Bibliotheks_und_Informationswissenschaft, Wissenschaft, Bildende_Kunst, Journalismus, Kunstgewerbe, Handschriften","",""
1,"","GVK129065544","?","Bibliotheksdienst","",,,"","",1967,"Berlin","","http://gso.gbv.de/DB=2.1/CMD?ACT=SRCHA&SRT=YOP&IKT=1016&TRM=ppn+129065544&sourceid=fbw_bibsonomy","","","","","","ZLB","","","","","","","","","Information_und_Dokumentation:_Allgemeines, Deutschland, Bibliothekswissenschaft, Bibliothek, Bibliothekspolitik","",""
1,"","2015literaturwissenschaft","","Literaturwissenschaft und Bibliotheken","",,,"","",2015,"","","http://dx.doi.org/10.14220/9783737004541","","","","","Alker, Stefan & Hölter, Achim","Vienna University Press","","","","","","","","Literaturwissenschaft und Bibliotheken | Bibliothek im Kontext","geisteswissenschaften, bibliothek","",""
1,"","consortium2015horizon","","NMC Horizon Report 2015 Library Edition","",,,"","",2015,"Austin, Texas","","http://www.nmc.org/publication/nmc-horizon-report-2015-library-edition/","","","","","Consortium, The New Media","The New Media Consortium","","","","","","","What is on the five-year horizon for academic and research libraries? The NMC Horizon Report: 2015 Library Edition examines key trends, significant challenges, and important developments in technology for their impact on academic and research libraries worldwide. This publication was produced by the NMC in collaboration with University of Applied Sciences (HTW) Chur, Technische Informationsbibliothek (TIB) Hannover, and ETH-Bibliothek Zurich. To create the report, an international body of experts from library management, education, technology, and other fields was convened as a panel. Over the course of three months, the 2015 NMC Horizon Project Library Expert Panel came to a consensus about the topics that would appear here. View the work that produced the report on the project wiki.","","bibliothek, mediennutzung, bildung","",""
9,"","gabriel2008konstruktion","Gabriel, Martin","Konstruktion einer rekombinanten Phage-Display-Antikörper-Bibliothek zur Isolierung von humanen monoklonalen Antikörpern gegen Lassavirus und Plasmodium falciparum","",,,"","",2008,"","","","","","","","","","","","","","Uni Marburg","","","","dnb, Gesundheit, Medizin","",""
9,"","kuntz1973lngere","Kuntz, Franz-Josef","Die Längere Notiz über den Puls im Codex Nr. 222 der Bibliothek des S[ank]t Nikolaus-Hospitals zu Kues","",,,"","",1973,"","","","","","","","","","","","","","Uni Köln","","","","dnb, Gesundheit, Medizin","",""
9,"","ullmann1994festphasensynthese","Ullmann, Dirk","Festphasensynthese einer Pentapeptid-Bibliothek und deren Nutzung zur Aufklärung der S'-Bindungsortspezifität der Cysteinprotease Clostripain aus Clostridium histolyticum","",,,"","",1994,"","","","","","","","","","","","","","Uni Leipzig","","","","dnb, Biologie","",""
10,"","oai:export","Bulaty, Milan; Huth, Anna-Katharina; Pfeifenberger, Regina; Tollkühn, Katharina & Winterhalter, Christian","Inspiration durch Raum ","",,64 ,"","",2010,"","[Online: Stand 2010-09-24T09:57:36Z]","http://edoc.hu-berlin.de/docviews/abstract.php?id=37017","","","","","","Humboldt-Universität zu Berlin, Humboldt University Berlin, Germany ","","","","","","","Alle glücklichen Bibliotheksbenutzer gleichen einander, jeder unglückliche Bibliotheksnutzer ist auf seine eigene Weise unglücklich. Sie haben es sicher gemerkt: Dies ist – leicht abgewandelt – der berühmte erste Satz in Tolstois „Anna Karenina“. Stimmt er? Ich glaube ja, denn die meisten Bibliotheksbenutzer sind glücklich, wenn sie in der Bibliothek die Bücher, Dokumente und Informationen finden, die sie suchen und benötigen, wenn die Bibliothek mit schönen Aussichten, anregender Atmosphäre und langen Öffnungszeiten das Studieren fördert und wenn sie beim Stöbern im Regal oder im Internet etwas finden, das ihnen – noch unbekannt – interessant erscheint. // Wir – die Bibliothekare, die Mitarbeiter des Computer- und Medienservice (CMS) sowie der Technischen Abteilung – sind glücklich, wenn unsere Arbeit Erfolg hat, wenn die Benutzerinnen und Benutzer des Jacob-und-Wilhelm-Grimm-Zentrums mit dem Haus und dessen Dienstleistungen glücklich und zufrieden sind. Das Haus ist fast die gesamte Öffnungszeit voll bzw. ausge¬lastet, die Schlangen an Ausleihe- und Rückgabeautomaten und Tresen sind lang. Der Andrang ist so groß, dass die Garderobenschränke leider nicht ausreichen. // Dieses Glück bzw. diese sehr gute Annahme des Gebäudes ist aus meiner Sicht in zwei Tatsachen begründet: Erstens hatten die Universitätsbibliothek, der CMS und die Technische Abteilung eine gute Konzeption und sie haben den richtigen Architekturentwurf ausgewählt. Zweitens war die Zusammenarbeit zwischen allen Beteiligten offen, vertrauensvoll und sehr produktiv. // Dieses Glück scheint einfach zu sein, war aber schwer zu erzielen. Über Gedanken, Konzepte und Realisation unserer Bemühungen gibt diese Publikation eine erste Auskunft. Aus unterschiedlichen Perspektiven und mit wechselnden Schwerpunkten werden die Rahmenbedingungen und Dienstleistungen im Jacob-und-Wilhelm-Grimm-Zentrum zum Zeitpunkt seiner Eröffnung im Oktober 2009 dargestellt. // In dieser Schrift können Sie erfahren, welche Arbeit, Gedanken und Leistungen hinter der schönen Fassade, den faszinierenden Leseterrassen und den im Grimm-Zentrum angebotenen Dienstleistungen standen und stehen. Sie werden hier herausfinden, warum die starke Nutzung des Grimm-Zentrums, das Glück der Nutzer und der Mitarbeiter nicht vom Himmel gefallen sind. Der Erfolg ist von allen gemeinsam erarbeitet. Doch lesen Sie selbst.","","bibliothek","",""
7,"","audunson_we_2018","Audunson, Ragnar Andreas","Do we need a new approach to library and information science?","Bibliothek Forschung und Praxis",,,"March","",2018,"","Preprint","https://edoc.hu-berlin.de/handle/18452/19699","","","","","","","","","","","","","Der vorliegende Beitrag analysiert den durch die Digitalisierung bedingten Druck auf das Bibliothekswesen und die Bibliotheks- und Informationswissenschaft sowie auf die zunehmende Bedeutung der Bibliotheken als Begegnungsorte und -arenen für die Öffentlichkeit. Beide Entwicklungstendenzen stellen die Notwendigkeit von Bibliothekaren als Vermittler zwischen Nutzern und Informationsquellen in Frage. Das Navigieren und Suchen nach Informationen in einer digitalen Welt, wenn die Welt selbst eine Bibliothek geworden ist, ist alles andere als trivial und die traditionellen Kompetenzen der Bibliothekare in Bezug auf das Suchen und Finden von Informationen sind so relevant wie eh und je. LIS-Ausbildungseinrichtungen sollten ihren Studenten auch die theoretische Werkzeuge zur Verfügung stellen, die ihnen helfen, über die Rolle und das Potenzial von Bibliotheken in Bezug auf die Herausforderungen einer nachhaltigen öffentlichen Sphäre im digitalen und multikulturellen Zeitalter nachzudenken. LIS-Ausbildungseinrichtungen sollten ihren Studenten auch die historische Kontinuität und das Erbe von Bibliotheken als Institutionen der öffentlichen Sphäre vermitteln.","","informationswissenschaft","",""
9,"","ullmann1994festphasensynthese","Ullmann, Dirk","Festphasensynthese einer Pentapeptid-Bibliothek und deren Nutzung zur Aufklärung der S'-Bindungsortspezifität der Cysteinprotease Clostripain aus Clostridium histolyticum","",,,"","",1994,"","","","","","","","","","","","","","Uni Leipzig","","","","Biowissenschaften, Chemie, dnb, Pflanzen_Botanik, Biologie, Tiere_Zoologie","",""
9,"","gabriel2008konstruktion","Gabriel, Martin","Konstruktion einer rekombinanten Phage-Display-Antikörper-Bibliothek zur Isolierung von humanen monoklonalaen Antikörpern gegen Lassavirus und Plasmodium falciparum","",,,"","",2008,"","","","","","","","","","","","","","Uni Marburg","","","","dnb, Gesundheit, Medizin","",""
9,"","hartig1969schedelsche","Hartig, Otto & Stauber, Richard","Die Schedelsche Bibliothek: Ein Beitr. z. Geschichte d. Ausbreitung d. italien. Renaissance, des dt. Humanismus u.d. medizin. Literatur","",,,"","",1969,"","","","","","","","","","","","","","Uni München","","","","Volkskunde, Verlagswesen, Hochschulen, Bildende_Kunst_allgemein, Enzyklopädien, Künste, Museumswissenschaft, Allgemeines, Nachrichtenmedien, Allgemeine_Sammelwerke, Erziehung, Schul_und_Bildungswesen, Kulturgeschichte, dnb, Geschichte, fortlaufende_Sammelwerke, Zeitschriften, Bibliografien, Wissenschaft, Journalismus, Organisationen","",""
6,"","conf/dc/RuhleSB14","Rühle, Stefanie; Schulze, Francesca & Büchner, Michael","Applying a linked data compliant model: The usage of the Europeana Data Model by the Deutsche Digitale Bibliothek.","",,,"","24-30",2014,"","","http://dblp.uni-trier.de/db/conf/dc/dc2014.html#RuhleSB14","Dublin Core Conference","","","","Moen, William E. & Rushing, Amy","Dublin Core Metadata Initiative","","","","","","","","","dblp","",""
9,"","willi2002pastoral","Willi, Konrad","Pastoral der Sterbebegleitung im Kloster der Barockzeit: dargestellt im Spiegel der Ars Moriendi-Literatur der Bibliothek St. Walburg, Eichstätt","",,,"","",2002,"","","","","","","","","","","","","","Uni München","","","","Psychologie, Theologie, Christentum, dnb, Gesundheit, Medizin","",""
9,"","brecht1961entwicklung","Brecht, Martin","Die Entwicklung der Alten Bibliothek des Tübinger Stifts in ihrem theologie- und geistesgeschichtlichen Zusammenhang: Eine Unters. zur württ. Theologie","",,,"","",1961,"","","","","","","","","","","","","","NA Tübingen","","","","dnb","",""
5,"978-3-1104-0336-7","books/degruyter/p/LinslerM16","Linsler, Anne & Mönnich, Michael","Förderung von Informationskompetenz in der KIT-Bibliothek unter besonderer Berücksichtigung der Ausbildung von Lernkompetenz als zentraler Komponente von Informationskompetenz.","",,,"","245-256",2016,"","","http://dblp.uni-trier.de/db/books/collections/SS2016.html#LinslerM16","Handbuch Informationskompetenz","","","","Sühl-Strohmenger, Wilfried","De Gruyter","","","","","","","","","dblp","",""
9,"","hoffmann2001interaktionen","Hoffmann, Melanie","Interaktionen und molekulare Charakterisierung von IgM- und IgG-Antikörpern der Phagen-Display-Bibliothek einer gesunden Probandin mit intravenösen Immunglobulinen","",,,"","",2001,"","","","","","","","","","","","","","HU Berlin","","","","dnb, Medizin","",""
9,"","krause1970slawischen","Krause, Friedhilde","Die slawischen Verbindungen der Königlichen Bibliothek zu Berlin und der Aufbau ihres Slavica-Bestandes seit ihrer Gründung bis 1871","",,,"","",1970,"","","","","","","","","","","","","","HU Berlin","","","","dnb","",""
9,"","hoffmann2001interaktionen","Hoffmann, Melanie","Interaktionen und molekulare Charakterisierung von IgM- und IgG-Antikörpern der Phagen-Display-Bibliothek einer gesunden Probandin mit intravenösen Immunglobulinen","",,,"","",2001,"","","","","","","","","","","","","","HU Berlin","","","","dnb, Gesundheit, Biologie, Medizin","",""
7,"","opitz2003document","Opitz, Andrea","Document Type Definitions zur Erschließung von Gattungen des Barock im Internet. Ein Projekt an der Herzog August Bibliothek Wolfenbüttel","Jahrbuch für Computerphilologie",5,,"","n.p.",2003,"","","http://computerphilologie.digital-humanities.de/jg03/opitz.html","","","","","Braungart, Georg; Eibl, Karl & Jannidis, Fotis","Mentis Verlag","","","","","","","","","tadirah_Editing, tadirah_tools","",""
7,"","PlieningerLiteraturverwaltung2008","Plieninger, Jürgen","Blickpunkt Internet Literaturverwaltung leichtgemacht: Wie Nutzer Literaturangaben und Volltextdateien in Ordnung halten können.","BuB: Forum Bibliothek und Information",7/8,,"","582-583",2008,"","","","","","","","","","","","","","","","","BuB - Forum für Bibliothek und Information","Literaturverwaltung, online, Software, BibSonomyZukunftReferat","",""
9,"","arr2005tabarischer","ar r, al-Q sim Ibn-Ê¿Al al & Mokhtarian, Bahar","Die Maq men des ar r in tabarischer Übersetzung (I-VII) nach einer Teheraner Handschrift: (Bibliothek Malek, ms. 2487)","",,,"","",2005,"","","","","","","","","","","","","","Uni Tübingen","","","","Literatur_in_anderen_Sprachen, dnb","",""
1,"","noauthororeditor","","Literaturwissenschaft und Bibliotheken","",,,"","",2015,"","","http://www.v-r.de/de/literaturwissenschaft_und_bibliotheken/t-1/1038170/","","","","Bibliothek im Kontext","Alker, Stefan & Hölter, Achim","Vienna University Press bei V&R unipress","","","","","","","DOI 10.14220/9783737004541 Literaturwissenschaft und Bibliotheken haben ein besonderes Verhältnis zueinander, ist doch die Literaturwissenschaft hauptsächlich in der Bibliothek an der Arbeit. Zugleich war das Nachdenken über Bibliotheken immer wieder von literaturwissenschaftlichen Entwürfen bestimmt. Doch wie sieht das Verhältnis heute aus? Der Sammelband sucht Antworten in Bereichen wie Literatur- und Bibliothekstheorie, Mediologie, literaturwissenschaftlicher Bibliotheksforschung, bibliothekarischer Literaturvermittlung und -versorgung oder der Forschung zu Bibliothekssujets und -metaphern. Mit der Thematisierung von Wissensordnung, Forschungsinfrastrukturen und philologischen Lehrbüchern gerät auch die tägliche Praxis literaturwissenschaftlicher Arbeit als Selbstbeobachtung moderner Geisteswissenschaften in den Blick.A special relationship exists between literature studies and libraries; after all, the study of literature mainly takes place in libraries. At the same time, reflections on libraries have repeatedly been characterised by literary concepts. What is the status of this relationship today, however? This anthology seeks answers in areas such as literary and library theory, mediology, literary library research, the mediation and provision of literature through libraries or research on library subjects and metaphors. Knowledge systems, research infrastructures and philological textbooks are also discussed, thereby bringing into focus the day-to-day practice of literary work as a form of self-observation of the modern humanities.","","books, bibliothekswesen, fachreferat.germanistik, bibliothekswissenschaft","",""
9,"","salow1926deutsche","Salow, Werner","Die deutsche Sprachwissenschaft in der Allgemeinen Deutschen Bibliothek: Ein Beitr. z. Gesch. d. deutsch. Philol. im Zeitalt. d. Aufklär.","",,,"","",1926,"","","","","","","","","","","","","","NA Greifswald","","","","dnb","",""
9,"","arr2005tabarischer","ar r, al-Q sim Ibn-Ê¿Al al","Die Maq men des ar r in tabarischer Übersetzung (I - VII) nach einer Teheraner Handschrift: (Bibliothek Malek, ms. 2487)","",,,"","",2005,"","","","","","","","Mokhtarian, Bahar","","","","","","Uni Tübingen","","","","Literatur_in_anderen_Sprachen, dnb","",""
9,"","jasbar1980darstellungen","Jasbar, Gerald","Darstellungen antiker Götter im Ms. [Manuskript] A. 10 (Augustinus, De civitate Dei) der Bibliothek der Oberschule in Schulpforte (DDR)","",,,"","",1980,"","","","","","","","","","","","","","Uni München","","","","Druckgrafik, Metallkunst, Landschaftsgestaltung, Bildende_Kunst_allgemein, Keramik, Künste, Plastik, Archäologie, Grafik, Malerei, Architektur, angewandte_Kunst, Alte_Geschichte, Numismatik, Buch_und_Schrift, Drucke, Raumplanung, dnb, Geschichte, Bildende_Kunst, Kunstgewerbe","",""
9,"","willi2002pastoral","Willi, Konrad","Pastoral der Sterbebegleitung im Kloster der Barockzeit: dargestellt im Spiegel der "Ars Moriendi"-Literatur der Bibliothek St. Walburg, Eichstätt","",,,"","",2002,"","","","","","","","","","","","","","Uni München","","","","Theologie, Christentum, dnb","",""
9,"","reuter1982codex","Reuter, Marianne","Text und Bild im Codex 132 der Bibliothek von Montecassino "Liber Rabani de originibus rerum": Unters. zur mittelalterl. Illustrationspraxis","",,,"","",1982,"","","","","","","","","","","","","","Uni Heidelberg","","","","dnb, Bildende_Kunst","",""
7,"","PlieningerLiteraturverwaltung2008","Plieninger, Jürgen","Blickpunkt Internet Literaturverwaltung leichtgemacht: Wie Nutzer Literaturangaben und Volltextdateien in Ordnung halten können.","BuB: Forum Bibliothek und Information",7/8,,"","582-583",2008,"","","","","","","","","","","","","","","","","BuB - Forum für Bibliothek und Information","literaturverwaltung","",""
7,"","PlieningerLiteraturverwaltung2008","Plieninger, Jürgen","Blickpunkt Internet Literaturverwaltung leichtgemacht: Wie Nutzer Literaturangaben und Volltextdateien in Ordnung halten können.","BuB: Forum Bibliothek und Information",7/8,,"","582-583",2008,"","","","","","","","","","","","","","","","","BuB - Forum für Bibliothek und Information","literaturverwaltung","",""
