BibliographyType,ISBN,Identifier,Author,Title,Journal,Volume,Number,Month,Pages,Year,Address,Note,URL,Booktitle,Chapter,Edition,Series,Editor,Publisher,ReportType,Howpublished,Institution,Organizations,School,Annote,Custom1,Custom2,Custom3,Custom4,Custom5
7,"","kasprzik_vorlaufer_2014","Kasprzik, Anna","Vorläufer der Internationalen Katalogisierungsprinzipien","Perspektive Bibliothek",3,2,"","120--143",2014,"","","https://journals.ub.uni-heidelberg.de/index.php/bibliothek/article/view/16809","","","","","","","","","","","","","Für eine korrekte und zielführende Formalerschlie{\textbackslash}s sung lassen sich drei Ebenen von Leitlinien definieren: Zielsetzungen, Prinzipien und Regeln der Katalogisierung. Der vorliegende Artikel befasst sich hauptsächlich mit den (möglichen) Zielsetzungen und Prinzipien der Katalogisierung. In der Einleitung der im Jahr 2009 herausgegebenen Ërklärung zu den Internationalen Katalogisierungsprinzipien{\textbackslash}" (ICP) ist vermerkt, dass die dort vorgelegte Prinzipiensammlung aufbaut auf {\textbackslash}"den gro{\textbackslash}s sen Katalogtraditionen der Welt{\textbackslash}". Diese Traditionen werden dann mit drei Referenzen aus der frühen Fachliteratur belegt: Den Schriften von Charles A. Cutter (1904), Shiyali R. Ranganathan (1955) und Seymour Lubetzky (1969). In diesem Artikel werden nach einem kurzen chronologischen Überblick die drei genannten Publikationen und insbesondere die darin enthaltenen Feststellungen zu Sinn und Zweck von international einheitlichen Prinzipien für die bibliothekarische Formalerschlie{\textbackslash}s sung in ihren geschichtlichen Kontext eingeordnet und ihr jeweiliger Einfluss auf die diversen existierenden Formulierungen von Zielen und Prinzipien näher beleuchtet. Au{\textbackslash}s serdem werden einige bemerkenswert moderne Gedankengänge in den betreffenden Schriften aufgezeigt. Ein abschlie{\textbackslash}s sendes Fazit fasst die wichtigsten Zielsetzungen und Prinzipien der Katalogisierung noch einmal mit Bezug auf die verwendete Literatur zur Theorie der Informationsorganisation zusammen.","","formalerschliessung","",""
7,"","kasprzik_automatisierte_2014","Kasprzik, Anna","Automatisierte und semiautomatisierte Klassifizierung : eine Analyse aktueller Projekte","Perspektive Bibliothek",3,1,"","85--110",2014,"","","http://journals.ub.uni-heidelberg.de/index.php/bibliothek/article/view/14022","","","","","","","","","","","","","Das sprunghafte Anwachsen der Menge digital verfügbarer Dokumente gepaart mit dem Zeit- und Personalmangel an wissenschaftlichen Bibliotheken legt den Einsatz von halb- oder vollautomatischen Verfahren für die verbale und klassifikatorische Inhaltserschliessung nahe. Nach einer kurzen allgemeinen Einführung in die gängige Methodik beleuchtet dieser Artikel eine Reihe von Projekten zur automatisierten Klassifizierung aus dem Zeitraum 2007-2012 und aus dem deutschsprachigen Raum. Ein Grossteil der vorgestellten Projekte verwendet Methoden des Maschinellen Lernens aus der Künstlichen Intelligenz, arbeitet meist mit angepassten Versionen einer kommerziellen Software und bezieht sich in der Regel auf die Dewey Decimal Classification (DDC). Als Datengrundlage dienen Metadatensätze, Abstracs, Inhaltsverzeichnisse und Volltexte in diversen Datenformaten. Die abschliessende Analyse enthält eine Anordnung der Projekte nach einer Reihe von verschiedenen Kriterien und eine Zusammenfassung der aktuellen Lage und der grössten Herausfordungen für automatisierte Klassifizierungsverfahren.","","automatisches_klassifizieren","",""
9,"","genest2004ibi","Genest, Annekathrin","Die Bibliothek des Polnischen Institutes Berlin : Überlegungen zum Marketing einer One-Person-Library im binationalen Kontext","Berliner Handreichungen zur Bibliothekswissenschaft",,149,"","39 S.",2004,"","","http://www.ib.hu-berlin.de/~kumlau/handreichungen/h149/","","","","","","Institut für Bibliothekswissenschaft der Humboldt-Universität zu Berlin","","","","","","","Werbung in eigener Sache gewinnt in Zeiten sich verschärfender Konkurrenz um schwindende Ressourcen auch im öffentlichen Sektor an Bedeutung. Dies gilt in besonderer Weise für die Bibliothek eines aus der Perspektive der Autorin ausländischen Kulturinstitutes, die sich mit ihren Informationsdienstleistungen sowohl im kulturellen Umfeld des Gastlandes als auch hinsichtlich ihrer Stellung innerhalb der Trägerinstitution zu positionieren hat. Vor diesem Hintergrund werden in vorliegender Arbeit Begriffe wie Öffentlichkeitsarbeit, Public Relations und Marketing erläutert und auf die Besonderheiten der Arbeitssitutation in einer One-Person-Library angewendet. Der Bezug zur Praxis wird mit der Entwicklung eines Marketingkonzeptes und die daran anschließende Diskussion von Methoden zur Evaluierung der Wirksamkeit der Marketingmaßnahmen hergestellt.Diese Veröffentlichung ist die überarbeitete Fassung einer Masterarbeit im postgradualen Fernstudiengang Master of Arts (Library and Information Science) an der Humboldt-Universität zu Berlin.","","marketing, Berlin, culture, libraries, Poland, Germany","",""
7,"","apel2012neues","Apel, Jochen","Ein neues Aufgabenfeld für Bibliotheken? Virtuelle Forschungsumgebungen in den Naturwissenschaften am Beispiel des Fachs Physik","Perspektive Bibliothek",1,2,"","77-105",2012,"","","http://archiv.ub.uni-heidelberg.de/ojs/index.php/bibliothek/article/view/9458","","","","","","","","","","","","","Dieser Artikel untersucht am Beispiel des Fachs Physik die folgenden beiden Fragen: Was müssen Virtuelle Forschungsumgebungen leisten, um moderne naturwissenschaftliche Forschung adäquat zu unterstützen, und auf welche Weise können Bibliotheken zur Realisierung dieser Leistungen beitragen? Im Hinblick auf diese Fragestellungen werden die Bereiche Projektmanagement, Informationsretrival und -management, Forschungsprimärdatenmanagement, elektronisches Publizieren und Langzeitarchivierung sowie organisatorische Querschnittsaufgaben in den Blick genommen. Es wird ein Katalog von möglichen Diensten und Anwendungen Virtueller Forschungsumgebungen in der Physik entwickelt und diskutiert welche Dienstleistungen Bibliotheken in diesem Zusammenhang anbieten könnten. Anhand dreier Fallbeispiele (HEP-CG, GAVO, AWOB) werden diese Überlegungen zudem mit der Praxis abgeglichen.","","science, bibliothekswissenschaft, digitalscholarship","",""
9,"","noauthororeditorarbeitspapiere","Sommet, Moritz","Bibliothek und Moderne in Japan: Das wissenschaftliche Bibliothekswesen zwischen System und Kultur ","",58,,"","",2011,"","","http://www.fbi.fh-koeln.de/institut/papers/kabi/band.php?key=70","","","","Kölner Arbeitspapiere zur Bibliotheks- und Informationswissenschaft ","","","","","","","FH Köln, Institut für Informationswissenschaft","","Die vorliegende Arbeit erklärt die gegenwärtigen Strukturen des Hochschulbibliothekssystems in Japan aus ihrer kulturhistorischen Entwicklung heraus. Im Mittelpunkt steht dabei die Frage nach Einflüssen der traditionellen japanischen Kultur auf das moderne Bibliothekswesen. Zunächst wird die Entwicklung des vormodernen Bibliothekswesens in Japan bis ca. 1850 geschildert. Sodann wird vor dem gesellschaftlichen und kulturellen Hintergrund der Entwicklung der japanischen Modernisierung bis in die Nachkriegszeit die Genese des modernen wissenschaftlichen Bibliothekssystems einschließlich des relevanten Verbandswesens und der Bibliothekarsausbildung erläutert. Das System der Hochschulbibliotheken wird dabei im Kontext angrenzender Systeme wie des Hochschulsystems und des allgemeinen Bibliothekssystems in Japan geschildert. Die internen Strukturen der japanischen Hochschulen und der ihnen angeschlossenen Bibliotheken sind der vorliegenden Darstellung zufolge in der Vorkriegszeit wesentlich vom Vorbild der zeitgenössischen deutschen Hochschulen beeinflusst gewesen, während in der Nachkriegszeit der US-amerikanische kulturelle Einfluss deutlich überwiegt. Die kooperative Bibliotheksarbeit, die Automatisierung und die Entwicklung hin zur digitalen Bibliothek vollzogen sich zwar gegenüber westlichen Ländern teils langsamer, führten aber doch zu einem leistungsfähigen und ausdifferenzierten Hochschulbibliothekssystem. Die Arbeit schildert zudem die Unterschiede zwischen Bibliotheken an privaten und staatlichen Trägerinstitutionen, zwischen älteren zweischichtigen und jüngeren einschichtigen Bibliothekssystemen, und die Rolle des japanischen Staates für die Bibliotheksentwicklung. Sie beschreibt auch einige der Herausforderungen des gegenwärtigen Systems: dazu zählen Probleme in der japanischen Bibliothekarsausbildung und die Entwicklungsperspektive der Träger vor dem Hintergrund der alternden japanischen Gesellschaft. Die Arbeit kommt zu dem Schluss, dass sich aus der Entwicklung des modernen Hochschulbibliothekssystems ein konsequenter kultureller Bruch mit der vormodernen japanischen Bibliothekstradition ersehen lässt. Die Modernisierung nach 1850 führte nicht nur zum Import von Techniken und systemischen Organisationsprinzipien des westlichen Bibliothekswesens, sondern auch die bibliothekarische Berufskultur wurde wesentlich von westlichem Gedankengut geprägt.","","bibliothekswesen, japan, malis","",""
9,"","haffner1994bibliothek","Haffner, Thomas","Die Bibliothek des Kardinals Giovanni d'Aragona (1456 - 1485): illuminierte Handschriften und Inkunabeln für einen humanistischen Bibliophilen zwischen Neapel und Rom","",,,"","",1994,"","","","","","","","","","","","","","Uni Heidelberg","","","","Verlagswesen, Christliche_Religion, Bibliothek, Buch, Bibliographien, Handschriften, Information_und_Dokumentation, Nachrichtenmedien, seltene_Bücher, dnb, Bibliotheks_und_Informationswissenschaft, Nachschlagewerke, Bildende_Kunst, Journalismus, Schrift","",""
1,"9783934682344","fuchs-kittowski_organisationsinformatik_2001","{Fuchs-Kittowski}, Klaus","Organisationsinformatik und Digitale Bibliothek in der Wissenschaft","",,,"","",2001,"","","","","","","","","{GeWiF}","","","","","","","","","imported","",""
5,"","Trommsdorf.1931","Trommsdorf, Paul","Ein \"Uberblick \"uber die Entwicklung der Bibliothek","",,,"","343--353",1931,"Hannover","","","100 Jahre Technische Hochschule Hannover","","","","","G{\"o}hmann","","","","","","","","","tibub","",""
9,"","engelmann1996babel","Engelmann, Susanna","Babel - Bibel - Bibliothek: Canettis Aphorismen zur Sprache","",,,"","",1996,"","","","","","","","","","","","","","Uni Freiburg","","","","Deutsche_Sprach_und_Literaturwissenschaft, dnb","",""
9,"","freckmann2004bibliothek","Freckmann, Anja","Die Bibliothek des Klosters Bursfelde im Spätmittelalter","",,,"","",2004,"","","","","","","","","","","","","","Uni Göttingen","","","","Theologie, Christentum, dnb, Bibliotheks_und_Informationswissenschaft, Bibliografien","",""
7,"","blumm2012access","Blümm, Mirjam","Open Access und Lizenzierung am Beispiel der Allianz-Lizenzen","Perspektive Bibliothek",1,2,"","31-52",2012,"","","http://archiv.ub.uni-heidelberg.de/ojs/index.php/bibliothek/article/view/9457","","","","","","","","","","","","","Im Kontext nationaler Lizenzen erscheinen die Begriffe Open Access auf der einen und Lizenzierung auf der anderen Seite zwei Gegenpole darzustellen – die freie versus kostenpflichtige Nutzung elektronischer Ressourcen. Der Aufsatz zeigt, warum dennoch beide Komponenten Bestandteil der neu entwickelten Allianz-Lizenzen sind.Dabei stellt er die verschiedenen Lizenzierungsmodelle der Deutschen Forschungsgemeinschaft in ihrer historischen Entwicklung von den Nationallizenzen Classics bis hin zu den seit Anfang des letzten Jahres bestehenden Allianz-Lizenzen vor. Letztere werden hinsichtlich ihrer Konzeption, des dahinterstehenden Lizenzierungsmodells und ihrer zukünftige Ausrichtung näher beleuchtet.Nachdem die Thematik in den Kontext der Open Access-Diskussion eingeordnet wurde, beschäftigt sich der Aufsatz im Weiteren mit der Position der Deutschen Forschungsgemeinschaft bezüglich der Handlungsfelder Open Access und Lizenzierung. Dem folgt eine Analyse, wie die Open Access-Komponente bei den einzelnen Produkten der Allianz-Lizenzen umgesetzt wurde und wie sich die Bedingungen von den in der SHERPA/RoMEO- Datenbank verzeichneten Rechten unterscheidet. Dies mündet in Überlegungen, wie die durch die Allianz-Lizenzen garantierten Open Access-Rechte bei den beteiligten Einrichtungen und Autoren umgesetzt werden können und ob sich dadurch künftig Veränderungen auf dem Publikationsmarkt ergeben.","","openaccess","",""
9,"","haffner1994bibliothek","Haffner, Thomas","Die Bibliothek des Kardinals Giovanni d'Aragona (1456 - 1485): illuminierte Handschriften und Inkunabeln für einen humanistischen Bibliophilen zwischen Neapel und Rom","",,,"","",1994,"","","","","","","","","","","","","","Uni Heidelberg","","","","Information_und_Dokumentation, Bibliothek, dnb, Buch, Schrift","",""
7,"","Hapke.1995b","Hapke, Thomas","Elektronische Zeitschriften in der Bibliothek der Zukunft","Auskunft . - Nordhausen : Bautz",15,2,"","150-166",1995,"","","","","","","","","","","","","","","","","","imported, Hapke_publication","",""
7,"","danowski2004bibliothek","Danowski, Patrick & Vo{\ss}, Jakob","Bibliothek, Information und Dokumentation in der Wikipedia","Information, Wissenschaft und Praxis",55,8,"","457ff.",2004,"","","http://hdl.handle.net/10760/5631","","","","","","","","","","","","","","","myown","",""
6,"978-3-486-58496-7","conf/mc/BrechtBK07","Brecht, Rike; Büchl, Bastian & Krömker, Heidi","myDMG-Lib - personalisierter Informationsraum einer digitalen Bibliothek.","",,,"","291-294",2007,"","","http://dblp.uni-trier.de/db/conf/mc/mc2007.html#BrechtBK07","Mensch & Computer","","","","Gross, Tom","Oldenbourg Verlag","","","","","","","","","dblp","",""
7,"","Lindel:2004","Lindel, Birgit","RFID-Technology f\"ur die Bibliothek der Zukunft","B.I.T.online",2,,"","108-112",2004,"","","","","","7","","","","","","","","","","Effizenzsteigerung und Kostenreduzierung sind heutezutage f{\"u}r Bibliotheken zentrale Schlagw{\"o}rter. Automatisierung und Selbstdienung tragen zunehmend zu diesem Zielen bei. Mit anwachsendem AV-Medien-Best{\"a}nden gewinnt eine zuverl{\"a}ssige Sicherung vermehrt an Bedeutung. Das BiblioChip System der Bibliotheca RFID Libary Systems AG bietet mittels RFID sowohl f{\"u}r gro{\"s}e als auch f{\"u}r keine Bibliotheken eine Optimierung all dieser Aspekte um ein Vielfaches. Essenzielles Resultat: Mehr Resourcen zur Bew{\"a}ltigung der best{\"a}ndig steigenden Anforderungen an Beratung und Service.","RFID in Libraries (Bibliotheken) Bibliography","RFID, Biliotheca, Zeitanalyse","",""
1,"","Schiller2000","von Schiller, Friedrich","Reclam Universal-Bibliothek, Nr.12, Wilhelm Tell","",,,"","",2000,"","","","","","","","","Reclam, Ditzingen","","","","","","","","","imported","",""
1,"","brockerhoff2012erfolgreiche","Brockerhoff, Christiane","Erfolgreiche Kommunikation mit Kunden in der Bibliothek","",,,"","",2012,"","","","","","","","","","","","","","","","","","Bibliothekswesen, Kundenorientierung, Auskunftsdienst, Kommunikation","",""
7,"","Hapke.1993d","Hapke, Thomas","Die Bibliothek der Sielkl\"ar-Versuchsstation Hamburg-Eppendorf","Stadthygiene und Abwasserreinigung nach der Hamburger Cholera-Epidemie . - Herzberg : Bautz",,,"","62-67",1993,"","","","","","","","","","","","","","","","","","imported, Hapke_publication","",""
9,"","soder1939quellenuntersuchung","Söder, Anna","Quellenuntersuchung zum 1. Buch der Apollodorschen Bibliothek","",,,"","",1939,"","","","","","","","","","","","","","NA Würzburg","","","","dnb","",""
9,"","heber2009bibliothek","Heber, Tanja","Die Bibliothek als Speichersystem des kulturellen Gedächtnisses","",,,"","",2009,"","","","","","","","","","","","","","Uni München","","","","dnb, Bibliotheks_und_Informationswissenschaft","",""
2,"","heikechristianedaume2012bibliothek","","Bibliothek entdecken! mit Kopiervorlagen auf CD - Bibliotheksführungen für die Schule. Leseförderungs-Bausteine in Zusammenarbeit von Schule und Bibliothek","",,,"","",2012,"","","","","","","","Heike Christiane Daume, Stadtbibliothek Villingen-Schwenningen","","","","","","","","","","Klassenführungen, Informationskompetenz","",""
7,"","birus2004bibliothek","Birus, Hendrik & Donat, Sebastian","Die Bibliothek der Weltliteratur. Ausgewählt von Markus Finkbeiner und Thomas Hafki (Digitale Bibliothek 89). Berlin: Directmedia 2004, [CD-ROM].","Jahrbuch für Computerphilologie",6,,"","n.p.",2004,"","","http://computerphilologie.digital-humanities.de/jg04/rezensionen/birusdon.html","","","","","Braungart, Georg; Eibl, Karl & Jannidis, Fotis","Mentis Verlag","","","","","","","","","tadirah_meta:_assessing, tadirah_literature","",""
9,"","voss2013haussystematiken","Voß, Viola","Von vier Haussystematiken zu einer Verbundklassifikation: Überlegungen zur Reklassifizierung der Bibliothek des Germanistischen Instituts der WWU Münster","",,,"","",2013,"","","http://nbn-resolving.org/urn:nbn:de:hbz:79pbc-2013100108","","","","","","","","","","","FH Köln","","Im Zuge der Neugründung des Germanistischen Institutes der Westfälischen Wilhelms-Universität Münster wurden bis Ende 2011 auch die ehemals eigenständigen vier Bibliotheken zu einer neuen Institutsbibliothek zusammengeführt. Jede Teilbibliothek brachte dabei eine eigene Haussystematik zur Aufstellung ihrer Bestände mit. Diese Systematiken haben unter-schiedliche Themenschwerpunkte, aber es gibt auch zahlreiche thematische Überschneidungen; daher können sie nicht problemlos nebeneinander eingesetzt werden. Zudem sind die Systematiken teilweise veraltet, die Tiefe und die Art der Untergliederung der Systematiken sind sehr heterogen und die Signaturen werden nach unterschiedlichen Prinzipien gebildet. Damit ergibt sich die Notwendigkeit einer neuen Systematik, nach der sich die Bestände integriert aufstellen lassen und die kontinuierlich gepflegt wird. Die Analyse der bislang verwendeten Systematiken, des Vorgehens vergleichbarer Bibliotheken und verschiedener möglicher Systematiken sowie einige Klassifizierungs-Stichproben aus dem Bestand der Institutsbibliothek zeigen, dass die Haussystematiken am besten durch die Regensburger Verbundklassifikation abgelöst werden könnte. Mit Überlegungen und Vorschlägen zu den notwendigen Entscheidungen und den einzelnen Projektabschnitten wird die Planung einer möglichen Reklassifizierung der Bibliothek vorbereitet.","zugl.: Köln, FH, Master-Arbeit, 2012.","myown, rvk, bibliothekswissenschaft","",""
9,"","seng1993weltanschauung","Seng, Thomas","Weltanschauung als verlegerische Aufgabe: der Otto-Reichl-Verlag 1909 - 1954 ; mit einer Bibliographie der Verlage von Otto Reichl und der Deutschen Bibliothek","",,,"","",1993,"","","","","","","","","","","","","","Uni Tübingen","","","","Verlagswesen, Bibliothek, Buch, Handschriften, Information_und_Dokumentation, Nachrichtenmedien, seltene_Bücher, dnb, Bibliotheks_und_Informationswissenschaft, Philosophie, Journalismus, Grenzgebiete_der_Wissenschaft_und_Esoterik, Schrift","",""
6,"","Ditlevsen.2005","Ditlevsen, Heike & Fischer, Bettina","Das neue Fortbildungsportal f\"ur Bibliothek und Information -- www.wissenbringtweiter.de","",,,"","217--219",2005,"Frankfurt a.M.","","","Leitbild Informationskompetenz","","","","Ockenfels, Marlies","Dt. Ges. für Informationswiss. und Informationspraxis","","","","","","","","","Information_Literacy_(2)","",""
7,"","journals/at/LiuF13","Liu, Liu & Frey, Georg","OOAD-Entwicklungsprozess einer Modelica-Bibliothek für vernetzte Automatisierungssysteme.","Automatisierungstechnik",61,2,"","131-",2013,"","","http://dblp.uni-trier.de/db/journals/at/at61.html#LiuF13","","","","","","","","","","","","","","","dblp","",""
9,"","ost1928friedrich","Ost, Guenter","Friedrich Nicolais Allgemeine deutsche Bibliothek (Ihre äußere Geschichte)","",,,"","",1928,"","","","","","","","","","","","","","NA Berlin","","","","dnb","",""
7,"","Woldering_2008_Europeana","Woldering, Britta","Europeana: Die Europäische Digitale Bibliothek - Entwicklungen und Perspektiven","Zeitschrift für Bibliothekswesen und Bibliographie",55,1,"","33-37",2008,"","","http://zs.thulb.uni-jena.de/receive/jportal_jparticle_00097069?XSL.view.objectmetadata.SESSION=false","","","","","","","","","","","","","","","europeana, MALIS09, EDL","",""
1,"978-3-447-05741-7, 3-447-05741-6, 978-3-447-05741-7","UBHD66511576","Sühl-Strohmenger, Wilfried","Digitale Welt und Wissenschaftliche Bibliothek - Informationspraxis im Wandel","",,,"","256 S.",2008,"","","","","","","Bibliotheksarbeit ; 14","","Harrassowitz","","","","","","","","",""Bibliothek, 2.0", Zukunftsmusik","",""
6,"3-925474-54-4","Ditlevsen.2005","Ditlevsen, Heike & Fischer, Bettina","Das neue Fortbildungsportal f\"ur Bibliothek und Information -- www.wissenbringtweiter.de","",,,"","217-219",2005,"Frankfurt a.M.","","","Leitbild Informationskompetenz","","","","Ockenfels, Marlies","Dt. Ges. für Informationswiss. und Informationspraxis","","","","","","","","Citavibeispielprojekt","CitaviBeispielProjekt, Informationskompetenz","",""
1,"","battles2012bcher","Battles, Matthew","Die Welt der Bücher - eine Geschichte der Bibliothek","",,,"","",2012,"","","","","","","","","","","","","","","","","","Bibliothekswesen","",""
9,"","schulerjuckenack1988aufbau","Schüler-Juckenack, Sigrid","Zum Aufbau einer vollständigen Gen-Bibliothek des Haushuhns","",,,"","",1988,"","","","","","","","","","","","","","Uni Bonn","","","","Landwirtschaft, dnb, Veterinärmedizin, Tiermedizin, Biologie","",""
6,"978-88579-286-4-7","conf/gi/Sandow11","Sandow, Saskia","Ressourcenplanung unter Nutzung der Java-Constraint-Bibliothek firstCS.","",192,,"","248",2011,"","","http://dblp.uni-trier.de/db/conf/gi/gi2011.html#Sandow11","GI-Jahrestagung","","","LNI","Heiß, Hans-Ulrich; Pepper, Peter; Schlingloff, Holger & Schneider, Jörg","GI","","","","","","","","","dblp","",""
7,"","Christensen2007","Christensen, Anne","Auskunft 2.0: Vom Wie und Wo der bibliothekarischen Antwort im Web 2.0","Bibliothek",31,2,"","172-176",2007,"","","http://www.bibliothek-saur.de/2007_2/172-176.pdf","","","","","","","","","","","","","","","auskunft, bibliothek, bibliothekswesen, web2.0, projektarbeit, bibliothek2.0","",""
7,"","Christensen2007","Christensen, Anne","Auskunft 2.0: Vom Wie und Wo der bibliothekarischen Antwort im Web 2.0","Bibliothek",31,2,"","172-176",2007,"","","http://www.bibliothek-saur.de/2007_2/172-176.pdf","","","","","","","","","","","","","","","auskunft, bibliothek, bibliothekswesen, web2.0, bibliothek2.0","",""
1,"","misc","Schützler, Lutz-Frieder","Bibliothek 2.0 - Notwendigkeit und Möglichkeiten neuer bibliothekarischer Dienstleitungen","",,,"","",2008,"","Bacheloarbeit, Hochschule der Medien, Stuttgart, 2008","http://opus.bsz-bw.de/hdms/volltexte/2008/649/","","","","","","","","","","","","","Aspekte,weshalb Bibliotheken eigene Dienstleistungen im Rahmen der Möglichkeiten des Web2.0 entwickeln solltendie Möglichkeiten des Web 2.0 aufgreifen und zur Kreation eigener Dienstleitungen nutzen sollten; Umsetzung in der Praxis","","Web2.0","",""
1,"","keyhere","Äng, Conny; Das, Henk; Dobbie, Allison & Kent, Susan","Die Öffentliche Bibliothek als realer und virtueller Ort","",,,"","",2001,"Gütersloh","","http://www.bertelsmann-stiftung.de/bst/de/media/Physisch_virtueller%20Ort.pdf","","","","","","Bertelsmann Stiftung","","","","","","","","","öffentliche-bibliothek, BIBLIOTHEKSWESEN","",""
6,"3-925474-54-4","Ditlevsen.2005","Ditlevsen, Heike & Fischer, Bettina","Das neue Fortbildungsportal für Bibliothek und Information – www.wissenbringtweiter.de","",,,"","217-219",2005,"","","","Leitbild Informationskompetenz: Positionen - Praxis - Perspektiven im europäischen Wissensmarkt: 27. Online-Tagung der DGI, 57. Jahrestagung der DGI, Frankfurt am Main 23. bis 25. Mai 2005","","","","Ockenfels, Marlies","","","","","","","","","","imported","",""
9,"","bukauskait2006kommentierter","Bukauskait, Dalia","Kommentierter Katalog der nachgelassenen Bibliothek von Johannes Bobrowski","",,,"","",2006,"","","","","","","","","","","","","","Uni Frankfurt Main","","","","dnb, Deutsche_Literatur, Bibliotheks_und_Informationswissenschaft, Bibliografien","",""
1,"","hutzler_bibliotheken","","Bibliotheken gestalten Zukunft: Kooperative Wege zur Digitalen Bibliothek","",,,"","",2008,"","","http://webdoc.sub.gwdg.de/univerlag/2008/hutzler_digitale_bibliothek.pdf","","","","","Hutzler, Gabriele Schweikl Evelinde","Universitätsverlag Göttingen","","","","","","","","","kataloge, gestalten, kooperative, wege, bibliotheken, recherche","",""
9,"","denglerschreiber1974scriptorium","Dengler-Schreiber, Karin","Scriptorium und Bibliothek des Klosters Michelsberg in Bamberg","",,,"","",1974,"","","","","","","","","","","","","","Uni Würzburg","","","","seltene_Bücher, Bibliographie, dnb, Buch_und_Bibliothekswesen, Bibliografien, Handschriften","",""
6,"","Ditlevsen.2005","Ditlevsen, Heike & Fischer, Bettina","Das neue Fortbildungsportal für Bibliothek und Information – www.wissenbringtweiter.de","",,,"","217–219",2005,"Frankfurt a.M.","","","Leitbild Informationskompetenz: Positionen - Praxis - Perspektiven im europäischen Wissensmarkt","","","","Ockenfels, Marlies","{Dt. Ges. für Informationswiss. und Informationspraxis}","","","","","","","","","Information_Literacy","",""
