BibliographyType,ISBN,Identifier,Author,Title,Journal,Volume,Number,Month,Pages,Year,Address,Note,URL,Booktitle,Chapter,Edition,Series,Editor,Publisher,ReportType,Howpublished,Institution,Organizations,School,Annote,Custom1,Custom2,Custom3,Custom4,Custom5
5,"","umberto_eco_die_2002","Eco, Umberto","'Die Beati Paoli' und die Ideologie des 'volkstümlichen Romans","",2,,"","531--553",2002,"Berlin","","","Nachwort zu: Luigi Natoli - Der Bastard von Palermo -  Der Roman der Beati Paoli","","","","","Aufbau Verlag","","","","","","","","","Geheimbünde,, Terrorismus, {Populärkultur-Italien-Populärliteratur,}, Hit_der_Geschichtswissenschaft, {Literatur-Italien,}, {Geschichte-Italien-Sozial-\_und\_Kulturgeschichte,}, {Literatur-Italien-Populärliteratur,}, {Literatur-Genre-Populärliteratur,}, Literaturwissenschaft,","",""
1,"","tilman_baumgrtel_vom_2002","Baumgärtel, Tilman","Vom Guerillakino zum Essayfilm: Harun Farocki - Werkmonographie eines Autorenfilmers","",,,"","",2002,"Berlin","","","","","2. verbesserte","","","b\_books","","","","","","","","","{Filmgeschichte-Deutschland-dffb,}, Hit_der_Geschichtswissenschaft, Filmgeschichte-Deutschland, {Filmgeschichte-Deutschland-60er+70er\_Jahre,}, dffb,, {Harun\_Farocki,}","",""
1,"","linda_williams_hard_1995","Williams, Linda","hard core – Macht, Lust und die Tradition des pornographischen Films","",,,"","",1995,"Basel/ Frankfurt am Main","","","","","","","","{Stroemfeld/Nexus}","","","","","","","","","Hit_der_Geschichtswissenschaft","",""
1,"","fjodor_gladkow_zement_1974","Gladkow, Fjodor","Zement","",,,"","",1974,"Berlin","Russisches Original unter dem selben Titel 1925.
Diese Fassung nach der Fassung in den Gesammelten Werken in acht Bänden, Band {II,} Moskau 1958","","","","","","","Volk und Welt","","","","","","","","","Literatur-Russland-20._Jhd.-Sowjetunion, Sozialistische_Literatur, Sozialistischer_Realismus","",""
7,"","naumann2015betriebswirtschaftslehre","Naumann, Ulrich","Betriebswirtschaftslehre und Bibliotheksmanagement oder: Wie viel Betriebswirtschaftslehre verträgt die Bibliothek? Essay für einen Vortrag beim Berliner Bibliothekswissenschaftlichen Kolloquium des Instituts für Bibliotheks- und Informationswissenschaft der Humboldt-Universität zu Berlin am 12.5.2015","",,,"","",2015,"","","http://userpage.zedat.fu-berlin.de/unaumann/Naumann_Betriebswirtschaftslehre-und-Bibliotheksmanagement-v1.pdf","","","","","","","","","","","","","","","bibliothekswesen, bibliothekswissenschaft","",""
1,"","dietlind_hchtker_elende_1999","Hüchtker, Dietlind","'Elende Mütter' und 'liederliche Weibspersonen' - Geschlechterverhältnisse und Armenpolitik in Berlin (1770-1850)","",,16,"","",1999,"Münster","","","","","","Theorie und Geschichte der bürgerlichen Gesellschaft","","Westfälisches Dampfboot","","","","","","","","","Geschichte-Thema-Obdachlosigkeit, Armenfürsorge, Sozialpolitik, Armut, Hit_der_Geschichtswissenschaft, Armenpolitik, Berlingeschichte","",""
1,"","fernand_braudel_la_1966","Braudel, Fernand","La Méditerranée et le monde méditerranéen à l'epoque de Philippe II","",,,"","",1966,"Paris","(dt. u. d. T.: Das Mittelmeer und die mediterrane Welt in der Epoche Philipps {II.,} Ffm: Suhrkamp 1990.","","","","","","","","","","","","","","","","Hit_der_Geschichtswissenschaft","",""
1,"","klaus_kreimeier_die_2002","Kreimeier, Klaus","Die Ufa-Story - Geschichte eines Filmkonzerns","",,,"","",2002,"Frankfurt am Main","Erstauflage {München/Wien} Hanser 1992","","","","","","","Fischer {TB}","","","","","","","","","Hit_der_Geschichtswissenschaft","",""
5,"978-3-11-030927-0","Keite.2013","Keite, Uta & Banduch, Raffael","Bücherhallen Hamburg im rechten Licht: Neue Beleuchtung in der Zentralbibliothek","",,,"","345-364",2013,"Berlin and Boston","Beleuchtung; Bibliotheken; Energieeinsparung; Energy conservation; Libraries; Lighting","","The Green Library - Die grüne Bibliothek","","","IFLA Publications","Hauke, Petra; Latimer, Karen & Werner, Klaus Ulrich","{De Gruyter Saur}","","","","","","","Die Bücherhallen Hamburg liefern ein Beispiel, auf welche Weise Bibliotheken ‚grüner‘ gestaltet werden können. Die Optimierung der Beleuchtung spielte eine entscheidende Rolle im Rahmen der Umbaumaßnahmen, um das kürzlich bezogene Kontorhaus den Anforderungen der Zentralbibliothek anzupassen. In Zusammenarbeit mit einem erfahrenen Lichtplaner und dem Architekten wurde die Beleuchtung entsprechend der Nutzung und dem Zweck der unterschiedlichen Zonen umgestaltet. Die einzelnen Bibliothekszonen mit eingesetzten Lampen, Leuchten und deren technischen Details sowie die daraus resultierenden Energieeinsparpotenziale werden beschrieben. Die Kosten werden den künftigen Ersparnissen gegenübergestellt. Schließlich werden ein Ausblick und der Anreiz zur Optimierung der Beleuchtung hinsichtlich eines positiven Einflusses auf Kundenzufriedenheit, Energie- und Kostenersparnis in der eigenen Bibliothek gegeben.Bücherhallen Hamburg – as one example of sustainability in libraries – made their central library greener by improving the lighting. While refurbishing the building in order to make it meet the requirements of a contemporary public library, the lighting facilities have been upgraded appropriately for the different library zones in collaboration with a lighting designer and the architect. This paper describes each zone, the installed lights and technical details as well as the resulting energy and investment savings. Finally the author puts the issue of lighting in perspective and encourages the optimization of lighting in order to achieve a positive impact on energy and investment savings in one’s own library.","","greenbib","",""
7,"","hohmann_neue_2010","Hohmann, Tina","Neue Lernorte: Learning und andere Grids an der Universität von Warwick","{BIBLIOTHEK} Forschung und Praxis",34,,"July","163--170",2010,"","","http://www.reference-global.com/doi/abs/10.1515/bfup.2010.029","","","","","","","","","","","","","","","imported","",""
7,"","thiessen2013sichtbarkeit","Thiessen, Peter","Sichtbarkeit von Open-Access-Monographien als Herausforderung - Zur Rolle und Aufgabe von Bibliotheken","Perspektive Bibliothek",2,2,"","4-35",2013,"","","http://dx.doi.org/10.11588/pb.2013.2.11242","","","","","","","","","","","","","","","openaccess","",""
1,"","walter_serner_die_1988","Serner, Walter","Die Tigerin","",,,"","",1988,"{Berlin/Ost}","Mit einem Nachwort von Joachim Schreck","","","","3","","","Das Neue Berlin","","","","","","","","","Kriminalliteratur,, {Literatur-Deutschland}","",""
1,"","marcello_brusegan_la_2006","Brusegan, Marcello","La cucina Veneziana","",,52,"","",2006,"Rom","","","","","","Tradizioni italiane Newton","","Newton Compton","","","","","","","","","Kochbuch,, {Geschichte-Italien-Sozial-\_und\_Kulturgeschichte,}, {Kochbuch-italienische\_Regionalküchen}","",""
1,"","ig_rote_fabrik_zwischen_1998","","Zwischen Berichte: Zur Diskussion über die Politik der bewaffneten und militanten LInken, in der BRD, Italien und der Schweiz","",,,"","",1998,"Berlin","","","","","","","Fabrik, {IG} Rote","{ID} Verlag","","","","","","","","","Hit_der_Geschichtswissenschaft, PT-Die_Nachkriegslinke_in_Italien","",""
1,"","helen_lefkowitz_horowitz_rereading_2002","Horowitz, Helen Lefkowitz","Rereading Sex - Battles over Sexual Knowledge and Suppression in Nineteenth-Century America","",,,"","",2002,"New York / Toronto","","","","","","","","Vintage Books","","","","","","","","","Hit_der_Geschichtswissenschaft","",""
1,"","friedrich_glauser_wachtmeister_1988","Glauser, Friedrich","Wachtmeister Studer","",,,"","",1988,"{Berlin/Ost}","mit einem Nachwort von Reinhard Hillich","","","","","","","Das Neue Berlin","","","","","","","","","Literatur-Genre-Krimi_und_Thriller-Schweiz, Literatur-Schweiz-20._Jhd., Kriminalliteratur","",""
14,"","fhhdb08","networking resources, ENRICH: European & information concerning cultural heritage","ENRICH: European networking resources and information concerning cultural heritage","",,,"","",2008,"","","http://enrich.manuscriptorium.com/","","","","","","","","","","","","","ENRICH Projekt zur Sammlung alter historischer Bestaende in einer digitalen Bibliothek. Seite hauptsaechlich in englisch, aber auch Teile in deutsch, tschechisch und anderen Sprachen","","fhhdb08","",""
1,"3407320728","Goehlich-2007-PaedagogischeTheoriendes","Göhlich, Michael","Pädagogische Theorien des Lernens","",,,"","",2007,"Weinheim ; Basel","","","Beltz Bibliothek","","","","","Beltz","","","","","","","","","Lerntheorie","",""
9,"","pollichpost2007leben","Pollich-Post, Claudia","Leben in Büchern: die Derneburger Bibliothek des hannoverschen Staatsministers Ernst Friedrich Herbert Graf zu Münster und seiner Frau Wilhelmine Charlotte, geb. Gräfin zu Schaumburg-Lippe, als kulturhistorisches Dokument und biografische Quelle","",,,"","",2007,"","","","","","","","","","","","","","Uni Hildesheim","","","","dnb, Bibliotheks_und_Informationswissenschaft","",""
7,"","goldner_winds_2010","Goldner, Matthew R.","Winds of Change: Libraries and Cloud Computing","{BIBLIOTHEK} Forschung und Praxis",34,,"December","270--275",2010,"","","http://www.reference-global.com/doi/abs/10.1515/bfup.2010.042","","","","","","","","","","","","","","","imported","",""
7,"","schild_rein_2015","Schild, Margret","Rein in die Verbünde, freischwebend oder auf die Wolke wartend?","AKMB-news: Informationen zu Kunst, Museum und Bibliothek",20,2,"","48--52",2015,"","","http://journals.ub.uni-heidelberg.de/index.php/akmb-news/article/view/26488","","","","","","","","","","","","","Der Bibliothekartag 2014 – mit mehr als 4.100 Teilnehmern – bot ein umfangreiches Programm mit Vorträgen zu insgesamt neun Themenkreisen, Raum für die unterschiedlichsten Arbeitstreffen, Mitgliederversammlungen sowie im Rahmenprogramm die Gelegenheit, die (Bibliotheks-)Region Bremen zu erkunden. Die Arbeitsgemeinschaft der Kunst- und Museumsbibliotheken organisierte in diesem Kontext einen Workshop für Museumsbibliotheken zum Thema Profilierung und Selbstverständnis, ein Treffen der AG Qualitätsmanagement zur Erarbeitung der nächsten Version der Standards, die von der Satzung vorgeschriebene Mitgliederversammlung sowie eine Vortrags- und Diskussionsrunde zum Thema Verbünde, über die an dieser Stelle berichtet wird ...","","bibliotheken","",""
7,"","goldner_winds_2010","Goldner, Matthew R.","Winds of Change: Libraries and Cloud Computing","{BIBLIOTHEK} Forschung und Praxis",34,,"December","270--275",2010,"","","http://www.reference-global.com/doi/abs/10.1515/bfup.2010.042","","","","","","","","","","","","","Thisarticle defines cloud computingand shows how it is different from other types of computing. It also discusses howcloud computing solutions could be beneficial to libraries in three basic areas:technology, data and community. ","Sieben potenzielle Verbesserungen für Bibliothken in der Cloud","CloudComputing, Libraries","",""
1,"9783930457793","glitsch_gottinger_2006","Glitsch, Silke & und Universitätsbibliothek Göttingen., Niedersächsische Staats","Göttinger Kostbarkeiten: Handschriften, Drucke und Einbände aus zehn Jahrhunderten","",,35,"","",2006,"Göttingen","","","","","","Göttinger Bibliotheksschriften","","Niedersächsische Staats- und Universitätsbibliothek","","","","","","","Der Ausstellungskatalog {"Göttinger} Kostbarkeiten- Handschriften, Drucke und Einbände aus zehn Jahrhunderten" zeigt 125 schöne, außergewöhnliche und besonders wichtige Werke der Niedersächsischen Staats-und Universitätsbibliothek Göttingen. Die Auswahl ihrer Schätze vermittelt einen Eindruck von dem erstaunlichen Reichtum und der außerordentlichen Vielfalt der Bestände einer Bibliothek, die bereits im 18. Jahundert Vorbild für Bibliotheksgründungen in Deutschland, in Europa und in Amerika wurde. Zugleich bietet sie einen anschaulichen Einblick in die Erwerbungsgeschichte der Bibliothek und zeigt, aus welch unterschiedlichen Quellen die Göttinger Bibliothekare gezielt und systematisch einzelne Titel oder ganze Sammlungen erwarben, auf welch verschlungenen und mitunter abenteuerlichen Wegen Handschriften und Bücher ihren Weg nach Göttingen fanden, um einen Bestand von einzigartiger Dichte zu bilden.","","imported","",""
1,"","lundrigan2010smartphone","Lundrigan, Lee; Graupera, Vidal & Allen, Sarah","Pro smartphone cross-platform development - iPhone, BlackBerry, Windows Mobile, and Android Development and Distriubution","",,,"","",2010,"PA USA","Bibliothek FH Salzburg","","","","","","","Apress","","","","","","","","","blackberry, android, entwicklung, iphone","",""
9,"","luttje1989entwicklung","Lüttje, Dieter","Über die Entwicklung der Amputation und Prothesenversorgung in den Jahren 1490 bis 1830: ein Beitrag zur bildlichen Darstellung im deutschsprachigen Raum anhand der gedruckten Abhandlungen in der Herzog-August-Bibliothek zu Wolfenbüttel","",,,"","",1989,"","","","","","","","","","","","","","MedH Hannover","","","","Soziologie, dnb, Gesellschaft, Gesundheit, Medizin","",""
10,"","binzarchiv","Binz, Vera","RDA: ARCHIV, MUSEUM & BIBLIOTHEK AUF EINEM NENNER?ÜBER DIE ZUKUNFT ANALOGER RESSOURCEN IN DIGITALEN,VERNETZTEN SYSTEMEN UND DIE MÖGLICHKEITEN IHRERDARSTELLUNG IM NEUEN REGELWERK RDA AM BEISPIEL EINESNACHLASSES DES DEUTSCHEN EXILARCHIVS","",,,"","",2011,"","","","","","","BERLINER HANDREICHUNGEN ZUR BIBLIOTHEKS- UND INFORMATIONSWISSENSCHAFT","","","","","","","","","","","Kultureinrichtung, Erfassung, Regelwerk, Museum, RDA","",""
9,"","blasermeier2019embedded","Blaser-Meier, Susanna","Embedded Librarianship und Forschungsdatenmanagement in den Geisteswissenschaften","",,,"","",2019,"","","https://edoc.hu-berlin.de/handle/18452/20553","","","","","Petras, Vivien","Humboldt-Universität zu Berlin","","","","","","","Ausgehend von der Frage nach möglichen bibliothekarischen Aufgabenfeldern in Zusammenhang mit der Erstellung von Datenmanagementplänen für geisteswissenschaftliche Forschungsprojekte  untersucht  die  vorliegende  Arbeit, inwieweit  die  Konzepte  des Embedded bzw.  des Liaison  Librarian für  die Forschungsunterstützung  fruchtbar  gemacht  werden  können.  Anhand  von  vier kunsthistorischen  Projekten  wird  der  Status  quo  und  der  mögliche  Bedarf  für zukünftige  Dienstleistungen abgeklärt. Das  Template  eines  Datenmanagementplans  dient  dabei  aus  Wegleitung,  um  im  Projektverlauf  diejenigen  Aufgaben herauszuarbeiten, die sich für die Unterstützung durch die Bibliothek besonders eignen. Es hat sich gezeigt, dass es für die Etablierung neuer Aufgabenbereiche im   Forschungsdatenmanagement seitens der Bibliothek einer intensiven Beziehungspflege zu den  Forschenden bedarf, wie beispielsweise ein Liaison Librarian sie leisten könnte.","","embeddedlibrarian, fachreferat, RDM","",""
5,"978-3-11-030927-0","Hauke.2013","Hauke, Petra & Werner, Klaus Ulrich","The second-hand library – a way of reducing the ecological footprint","",,,"","175-194",2013,"Berlin and Boston","Bibliotheksbau; Library buildings; Nachhaltigkeit; Remodeling; Sustainability; Umbau","","The Green Library - Die grüne Bibliothek","","","IFLA Publications","Hauke, Petra; Latimer, Karen & Werner, Klaus Ulrich","{De Gruyter Saur}","","","","","","","Old buildings are being converted into libraries all over the world. The process of re-using a building which formerly had a different function into a library is quite obviously a recycling issue. The transformation of an existing building with a prior non-library function into a library brings the challenge and the opportunity for sustainable thinking in library planning. As non-renewable resources are decreasing, re-using and recycling are going to become increasingly necessary in the future. The recycling of old buildings means reducing the ecological footprint of library buildings in a cost-effective and efficient way. Quite apart from “green” aspects like water conservation, energy conservation, recycled or sustainable building materials, indoor air quality, and solar power from photovoltaic panels, the planning of an adaptive re-use is a very different task than the planning of a library in a totally new building. Some best-practice case studies from different countries are presented.Überall auf der Welt werden bestehende alte Gebäude in Bibliotheken umgewandelt. Dieser Prozess der Umwidmung eines Gebäudes mit einer vormals anderen Funktion ist ganz offensichtlich ein Fall von Recycling. Die Umwandlung eines Bestandsgebäudes in eine Bibliothek stellt eine Herausforderung und eine Chance dar, Nachhaltigkeitsaspekte in die Planung einzubringen. Da nicht erneuerbare Ressourcen schwinden, wird das Wiederverwenden und Recycling in Zukunft zunehmend notwendiger. Das Recycling eines alten Gebäudes bedeutet, den ökologischen Fußabdruck eines Bibliotheksgebäudes auf kosteneffiziente und effektive Weise zu verringern. Abgesehen von den ‚grünen‘ Themen wie z.B. die Verringerung des Wasserverbrauches, Energieeinsparung, die Verwendung von aufbereiteten und nachhaltig produzierten Baumaterialien, die Qualität der Innenraumluft oder die Nutzung von Solarenergie mittels Fotovoltaik ist die Nachnutzung eine gänzlich andere Herausforderung als die Planung eines völlig neuen Bibliotheksgebäudes. Drei Best Practice Beispiele aus unterschiedlichen Ländern sollen das illustrieren.","","greenbib","",""
1,"","StHe08-Ijo","Stahl, G & Hesse, F.","International journal of computer-supported collaborative learning","",3,1,"March","1-97",2008,"New York","","","","","","","","Springer Verlag","","","","","","","","","Hauptbücherregal, IMTM-Bibliothek","",""
5,"978-3-11-030927-0","Sahavirta.2013","Sahavirta, Harri","“… proud that my own library is such a responsible operator!”: Vallila Library in Helsinki shows the greener way","",,,"","317-332",2013,"Berlin and Boston","Green libraries; Grüne Bibliotheken; Sustainable activities; Umweltarbeit","","The Green Library - Die grüne Bibliothek","","","IFLA Publications","Hauke, Petra; Latimer, Karen & Werner, Klaus Ulrich","{De Gruyter Saur}","","","","","","","The discussion around green libraries has been largely limited to the buildings, i.e., to subjects like the energy efficiency of new constructions and basic renovations. However, we cannot rebuild all libraries and we have to operate environmentally in existing buildings and without new resources. Libraries can express their commitment to green values and offer an open and easy access to environmental knowledge. Moreover, offering shared space and new kinds of items to be borrowed are examples of new environmentally sustainable activities. To take a clear stand and to create a visible green image for the library is an important part of environmental work. Sustainability and new, environmentally friendly services are ways to create a good image and thus to market libraries to decision makers and customers.Die Diskussion über ‚grüne‘ Bibliotheken war bisher weithin beschränkt auf die Gebäude, bspw. auf Themen wie die Energieeffizienz bei Neubauten und bei Renovierungen. Allerdings können nicht alle Bibliotheken neu gebaut werden, denn auch in bereits existierenden Gebäuden muss umweltfreundlich und ohne neue Ressourcen gearbeitet werden können. Bibliotheken können ihr Engagement für grüne Werte deutlich machen und einen freien und leichten Zugang zu umweltbezogenem Wissen anbieten. Doch darüber hinaus sind gemeinschaftliche Räume und neuartige Ausleihobjekte gute Beispiele für innovative Umwelt- und Nachhaltigkeitsaktivitäten. Deutlich Stellung zu beziehen und ein sichtbar grünes Image zu entwickeln, ist ein wichtiger Teil der Umweltarbeit einer Bibliothek. Nachhaltigkeit und neue umweltfreundliche Angebote sind ein Weg, ein positives Image zu gestalten und so Bibliotheken gegenüber Entscheidungsträgern und Kunden als ‚Marke‘ zu präsentieren.","","greenbib","",""
7,"","scharf2011nette","Scharf, Andreas","Eine nette Geste - SWT Touch and Gesture Support in Indigo","Eclipse Magazin",5.2011,,"August","60-63",2011,"","","http://it-republik.de/jaxenter/eclipse-magazin-ausgaben/Indigo-000460.html","","","","","","","","","","","","","Mit dem Indigo Release wird auch die SWT Bibliothek um das ein oder andere zeitgemäße Feature aufgewertet. In der Version 3.7 findet sich die SWT Touch & Gesture API, mit der SWT-basierte Anwendungen auf Berührungen und Gesten reagieren können.","","java, umllab, myown, zenobios, touch, indigo, swt, eclipse, gesture, yatta","",""
1,"","deborah_cameron_lust_1990","Cameron, Deborah & Frazer, Elizabeth","Lust am Töten - Eine feministische Analyse des Sexualmorden","",,,"","",1990,"Frankfurt am Main","Org. u. d. T.: The Lust to Kill, Polity Press/ Basil Blackwell 1987","","","","","Die Frau in der Gesellschaft","","Fischer {TB}","","","","","","","","","Kriminalität-sexualisierte_Gewalt, Sexualmord-Literatur, sexualisierte_Gewalt, Feminismus, Kriminalistik, Kriminalistik-sexualisierte_Gewalt","",""
1,"","anton_tschechow_ein_1987","Tschechow, Anton","Ein Drama auf der Jagd","",,,"","",1987,"{Berlin/Ost}","","","","","","","","Das Neue Berlin","","","","","","","","","Literatur-Genre-Krimi_und_Thriller-Russland, Literatur-Russland, Kriminalliteratur","",""
5,"","jrgen_zimmerer_der_2004","Zimmerer, Jürgen","Der koloniale Musterstaat? Rassentrennung, Arbeitszwang und totale Kontrolle in Deutsch-Südwestafrika","",,,"","26--41",2004,"Berlin","","","Völkermord in {Deutsch-Südwestafrika} - Der Kolonialkrieg (1904-1918) in Namibia und seine Folgen","","2","","Zimmerer, Jürgen & Zeller, Joachim","Ch. Links","","","","","","","","","Geschichte-Deutschland-20._Jhd.-Jahrhundertwende_19.-20._Jhd., Kolonialismus,, {Kolonialismus-Deutschland}","",""
1,"","michaela_wunderle_politik_1977","","Politik der Subjektivität - Texte der italienischen Frauenbewegung","",,,"","",1977,"Frankfurt am Main","","","","","","","Wunderle, Michaela","Suhrkamp","","","","","","","","","{Geschichte-Italien-20.\_Jhd.-1943-1993-1960er-70er\_Jahre,}, Geschichte_der_Linken-Italien-Neue_Linke-Frauenbewegung_2.Welle, PT-Die_Nachkriegslinke_in_Italien, Feminismus,, {Geschichte-Italien-20.\_Jhd.-Operaismus,}","",""
1,"","albrecht_koschorke_der_2007","Koschorke, Albrecht; Lüdemann, Susanne; Frank, Thomas & de Mazza, Ethel Matala","Der fiktive Staat - Konstruktionen des politischen Körpers in der Geschichte Europas","",,,"","",2007,"Frankfurt am Main","","","","","","","","Fischer {TB}","","","","","","","","","Geschichte-Thema-politische_Metaphern, Staatstheorie, Medizingeschichte-Mittelalter, Medizingeschichte, Geschichte-Europa-17.-18._Jhd., Geschichte-Europa-15.-16._Jhd., Geschichte-Körpergeschichte","",""
1,"","GVK13063106X","?","Neuerscheinungen über die Europäischen Gemeinschaften","",,,"","",1985,"Luxembourg","","http://gso.gbv.de/DB=2.1/CMD?ACT=SRCHA&SRT=YOP&IKT=1016&TRM=ppn+13063106X&sourceid=fbw_bibsonomy","","","","","","Amt für amtl. Veröff. d. Europ. Gemeinschaften","","","","","","","","","imported","",""
1,"","carsten_kther_ruber_1976","Küther, Carsten","Räuber und Gauner in Deutschland","",,,"","",1976,"Göttingen","","","","","","","","Vandenhoeck \& Ruprecht","","","","","","","","","Geschichte-Thema-Obdachlosigkeit, Hit_der_Geschichtswissenschaft, Geschichte-Deutschland-18._Jhd., Geschichte-Deutschland-19._Jhd., Geschichte-Thema-Kriminalität, Kriminalität","",""
1,"","gilbert_keith_chesterton_das_1977","Chesterton, Gilbert Keith","Das unlösbare Problem - Zehn Pater Brown Geschichten","",,,"","",1977,"{Berlin/Ost}","erworben 06/08","","","","","","","Das Neue Berlin","","","","","","","","","imported","",""
1,"","hugo_bettauer_die_1996","Bettauer, Hugo","Die Stadt ohne Juden - Ein Roman von Übermorgen","",,,"","",1996,"Hamburg / Bremen","","","","","","","","Achilla","","","","","","","","","Antisemitismus-Österreich, Antisemitismus, Literatur-Österreich","",""
1,"","jacques_legoff_die_1990","","Die Rückeroberung des historischen Denkens - Grundlagen der Neuen Geschichtswissenschaft","",,,"","",1990,"Frankfurt am Main","im frz. Org. u. d. T.: La nouvelle histoire, Paris: {Retz-C.E.P.L.} 1978","","","","","","{LeGoff}, Jacques; Chartier, Roger & Revel, Jacques","S. Fischer","","","","","","","","","Geschichtswissenschaft-Strömungen-Les_Annales, PT-Theorien_der_Geschichtsschreibung, Geschichtswissenschaft-Theorie","",""
1,"","michel_foucault_archologie_2005","Foucault, Michel","Archäologie des Wissens","",,,"","",2005,"Frankfurt am Main","im franz. Org. u. d. T.:","","","","14","","","Suhrkamp","","","","","","","","","{Wissenschaftsgeschichte-Soziologie,}, Wissenssoziologie, {Michel\_Foucault,}, {Wissenschaftsgeschichte-Geschichte\_der\_Geisteswissenschaften,}, Wissenschaftsgeschichte,","",""
1,"","steve_wright_den_2005","Wright, Steve","Den Himmel stürmen - Eine Theoriegeschichte des Operaismus","",,,"","",2005,"{Berlin/Hamburg}","","","","","","","","Assoziation A","","","","","","","","","Hit_der_Geschichtswissenschaft, PT-Die_Nachkriegslinke_in_Italien","",""
1,"","orlando_figes_die_1998","Figes, Orlando","Die Tragödie eines Volkes - Die Epoche der russischen Revolution 1891 bis 1924","",,,"","",1998,"Berlin","im Org. u. d. T.: A people's Tragedy. The Russian Revolution 1891-1924, London: Jonathan Cape 1996","","","","","","","Berlin Verlag","","","","","","","","","imported","",""
1,"","mile_gaboriau_der_1988","Gaboriau, Émile","Der Fall Lerouge","",,,"","",1988,"{Berlin/Ost}","erstmals 1867","","","","3","","","Das Neue Berlin","","","","","","","","","Detektivroman, Detektive, Quelle, Hitquelle_für_Geschichtsschreibung, Literatur-Frankreich-19._Jhd., Literatur-Frankreich, Literatur-Genre-Krimi_und_Thriller-Frankreich, Kriminalliteratur","",""
